index,title,artist,propertyA,materialA,propertyB,materialB,propertyC,materialC,propertyD,materialD,transform,application,texture,final property,keyword,link1,Well Proven Chair,Marjan van Aubel James Shaw,plant,timber,bioresin,bioresin, , , , ,mix,furniture,hard,paint,timber wood foam furniture chair rough,http://wellprovenchair.com/about.html2,Structural Skin,Jorge Penades,animal,leather,bioresin,natural bone glue, , , , ,heat,furniture,hard,material,wood furniture chair table,https://materialdistrict.com/article/structural-skin/3,Stone Recycling,Tom van Soest,mineral,stone,plastic,plastic, , , , ,mix,construction,hard,rock,brick commercial tile multi-functional,https://www.stonecycling.com4,Materia Madura,Ana Christina Qui s,plant,plantain waste,metal,aluminium waste,food,coffee, , ,mix,material,hard,material,material Puerto Rico stone location-based coffee metal,http://www.anacristinaqui s.com/index-montauk#/materia-madura5,Hot Wire Extensions ,Studio Llio Seongil Choi Fabio Hendry,plastic,sls print waste,chemical,silica sand, , , , ,heat,furniture,hard,material,3d-print plastic sls pla mineral structure art,https://www.dezeen.com/2015/06/30/studio-ilio-electricity-form-solid-objects-wire-nylon-powder-3d-printing-waste/6,Newspaper Wood,Mieke Meijer ,paper,newspaper,chemical,glue, , , , ,compress,construction,hard,wood,wood glue furniture construction commercial tile,https://miekemeijer.com/newspaperwood7,Micro Urban Mining,Jorien Wiltenburg,metal,electronic (aluminium), , , , , , ,knit,textile,soft,textile,electronics metal knit weave textile metallic,http://jorienwiltenburg.nl/work19.html8,Precious Plastic,Dave Hakkens,plastic,plastic, , , , , , ,heat,material,hard,bioplastic,plastic melt heat heatpress machine blend shred,https://preciousplastic.com/9,Joining Bottles,Micaella Pedros,plastic,plastic bottle, , , , , , ,heat,mechanism,hard,bioplastic,joint plastic bottle furniture wood mechanic,https://micaellapedros.com/10,Forest Pine Wool,Tamara Orjola ,plant,pine needles, , , , , , ,compress,furniture,soft,textile,pine wool carpet soft hard multi-functional furniture chair heatpress,http://tamaraorjola.com/11,Reconfiguration of a Tree,Thomas Vailly,plant,pinus pinaster,chemical,cellulose,algae,lignin,plant,rosin,heat,resin,hard,material,bio-resin bowl mug mould,http://studiothomasvailly.com/12,Willow Project,Iceland Academy of the Arts,plant,willow branches,water,water, , , , ,heat,pigment,hard,paint,willow plant,https://www.dezeen.com/2016/03/18/iceland-academy-arts-product-design-students-willow-project-materials-range-designmarch-2016/13,Sea Me Collection,Studio Nienke Hoogvliet,algae,seaweed, , , , , , ,heat,dye,soft,paint,seaweed algae translucent soft textile chair weave,https://www.nienkehoogvliet.nl/14,Terroir,Jonas Edvard Nikolaj Steenfatt ,algae,seaweed, , , , , , ,dry,furniture,soft,paint,seaweed composite chair rough furniture hard,https://jonasedvard.dk/work/terroir/15,Cochayuyo,Sisa Collection,algae,bull kelp, , , , , , ,dry,textile,flexible,textile,clothing textile hard,https://www.sisacollection.com/cochayuyo16,Cornspan and From Chiang Mai,Apilada Vorachart,plant,corn husk,plant,charcoal, , , , ,heat,material,hard,material,panel sound thermal insulation music,https://materialdistrict.com/material/cornspan/17,Solidwool,Justin and Hannah Floyd,animal,sheep wool,bioresin,bioresin, , , , ,heat,furniture,hard,furniture,furniture hard,https://www.solidwool.com/about18,From Insects,Marlene Huissoud,animal,black propolis,insect,cocoon,insect,natural bee resin,insect,sikworm,heat,resin,hard,glass,natural bio-resin glass clay,https://www.marlene-huissoud.com/from-insects-product/19,Merdacotta,Gianantonio Locatelli Luca Cipelletti,animal,cow dung,mineral,clay,plant,straw, , ,mix,material,hard,rock,brick hard furniture installation,http://www.theshitmuseum.org/about/20,Mestic,Jalila Essaidi,animal,manure ,chemical,cellulose, , , , ,grow,textile,soft,bioplastic,biotextiles bioplastic paper textile cellulose-derivatives,https://jalilaessaidi.com/cowmanure/21,The New Age of Trichology,Sanne Visser,human,hair,chemical,resin, , , , ,knit,textile,soft,textile,hair fabric fishing textile net,https://cargocollective.com/sannevisser/The-New-Age-of-Trichology22,Hair Highway,Studio Swine,human,hair, , , , , , ,compress,material,hard,furniture,natural resin bioplastic amber translucent aesthetics art,https://www.studioswine.com/work/hair-highway/23,The Colour of Hair,Fabio Hendry Martijn Rigters,human,hair,metal,aluminium , , , , ,heat,pigment,hard,paint,color metal black pigment coating,https://www.martijnrigters.com/the-colour-of-hair-objects24,Dust Matters,Lucie Libotte,dust,dust, , , , , , ,grow,pigment,hard,coating,jewlery ceramic glaze,http://lucielibotte.com/25,The Dust Collection,Agusta Sveinsdottir ,dust,dust,bioresin,bio-resin, , , , ,compress,material,hard,coating,jewlery stone marble coating small rough,https://www.domusweb.it/en/news/2014/05/23/agusta_sveinsdottir_dust.html26,How Dust This Feel?,Matilda Beckman,dust,dust,chemical,glue, , , , ,compress,furniture,hard,coating,black marble smooth construction furniture,https://www.dezeen.com/2015/02/06/matilda-beckman-furniture-made-from-dust-stockholm-2015/27,Bottle-up,Super Local design studio,glass,glass waste,mineral,cement, , , , ,mix,material,hard,rock,construction material hard tile location-oriented East-Africa ,https://www.bottle-up.org/28,Beyond the Mainland,Phoebe Quare,seafood,mussel shell, , , , , , ,mix,material,hard,material,hard plaster location-oriented Ireland marine homeware ceramic marine seafood,https://www.dezeen.com/2015/02/06/matilda-beckman-furniture-made-from-dust-stockholm-2015/29,Karawane,Pour le Alpes,plant,wheat,plant,rye straw, , , , ,knit,textile,soft,textile,weave textile tradition knit swiss straw location-oriented,https://www.formandseek.com/karawane30,Agar Plasticity,AMAM,algae,agar, , , , , , ,heat,material,soft,bioplastic,bioplastic translucent solid homeware hard disposability biodegradable translucent,https://www.a-ma-m.com/agarplasticity31,EcoGrill,Lou Moria,plant,pine fibre, , , , , , ,heat,textile,soft,cooking method,temporary outdoor cooking grill utensil,https://www.loumoria.com/tracing-paper-c1agn32,Short Life,Kay Politowicz Sandy Maclennan,plant,plant-based lyocell, , , , , , ,heat,textile,soft,textile,fashion textile clothing short-life,http://www.tedresearch.net/research/detail/short-life/33,Polyspolia,Will Yates-Johnson ,chemical,phenolic resin,plastic,thermosetting plastic,chemical,calcium carbonate,mineral,wood flour,heat,material,hard,bioplastic,bioplastic reform plastic thermosetting recycle,https://whyj.uk/polyspolia34,Collection 1,Crafting Plastics Studio,plant,plant,textile,textile, , , , ,heat,material,hard,bioplastic,bioplastic eyewear glasses compostable durable,https://www.craftingplastics.com/collection-135,Flax Chair,Christien Meindertsma,plant,flax,starch,pla, , , , ,heat,furniture,hard,bioplastic,bioplastic chair furniture hard flax pla,https://christienmeindertsma.com/Flax-Chair36,MycoWork,MycoWork,fungi,mycelium, , , , , , ,grow,textile,flexible,leather,leather grow mycelium biodegradable mushroom,https://www.mycoworks.com/37,Growing Lab,Officina Corpuscoli,fungi,mycelium, , , , , , ,grow,material,soft,bioplastic,bioplastic mycelium fungi achictecture design grow,https://www.corpuscoli.com/projects/the-growing-lab/38,Mycelium Textile,Carole Collet,fungi,mycelium, , , , , , ,heat,textile,soft,coating,textile pattern mycelium  grow,https://www.domusweb.it/en/design/gallery/2019/04/01/carole-collet-mycelium-textiles.html39,Grow It Yourself,Krown Design,fungi,mycelium,water,water, , , , ,grow,furniture,hard,material,lamp homeware mycelium mushroom grow,https://www.krown-design.com/product-category/grow-it-yourself/?product_view=list40,Invisible Resources,Zuzana Gombosova,plant,cellulose,fungi,bacteria, , , , ,grow,pattern,hard,coating,paint bacterial cellulose pigment grow,https://www.frameweb.com/news/invisible-resources-by-zuzana-gombosova41,Interwoven ,Diana Scherer,food,oat,plant,wheat, , , , ,mix,composite,hard,material,grow plant carpet pattern textile clothing rough root rootsystem,http://dianascherer.nl/42,New Geology,Jorien Wiltenburg,plastic,plastic,textile,textile,glass,glass,metal,steel,compress,furniture,hard,rock,furniture recycle marble rough,http://jorienwiltenburg.nl/work14.html43,Plastiglomerate Samples,Kelly Jazvac,plastic,plastic waste,mineral,stone, , , , ,mix,furniture,hard,rock,art sculpture waste environment history grow,http://www.kellyjazvac.com/Stones/Stones.html44,Coffee Composite Co02,Pilar Bolumburu,food,coffee ground,vinegar,vinegar,glycerin,glycerin,water,water,mix,composite,hard,material,composite bowl mug mould hard homeware rough,https://materiom.org/recipe/17145,Carrageenan iota,Zoë Powell  ,algae,carrageenan iota,glycerin,glycerin,water,water, , ,heat,composite,hard,material,leather soft translucent,https://materiom.org/recipe/12046,Eggshell biocomposite,María José Besoain Alejandro Weiss LABVA,food,eggshell,vinegar,vinegar,chemical,alginate,water,water,heat,composite,flexible,material,composite hard solid,https://materiom.org/recipe/6047,Sawdust / agar - starch,Tamara Schwarz,algae,agar agar,glycerin,glycerin,water,water,starch,starch,heat,bioplastic,flexible,bioplastic,composite container cork rough homeware,https://materiom.org/recipe/5348,Chitosan 12% - Stiff behaviour,Soraya Bornaz,seafood,chitosan,glycerin,glycerin,vinegar,vinegar,water,water,grow,bioplastic,soft,bioplastic,rubber bioplastic soft flexible seefood marine,https://materiom.org/recipe/4849,Kombucha Fabric,LABVA,food,green tea,food,sugar,chemical,sodium bicarbonate,water,water,grow,textile,soft,textile,soft translucent fermentated origami,https://materiom.org/recipe/4250,Cork / agar - starch,Fab Lab Santiago,algae,agar agar,glycerin,glycerin,starch,starch,plant,cork,heat,composite,hard,material,cork composite homeware,https://materiom.org/recipe/4051,Agar bioplastic ,Clara Davis  ,algae,agar agar,glycerin,glycerin,water,water, , ,heat,bioplastic,soft,bioplastic,translucent bioplastic soft flexible,https://clara-davis.com/albums/bioplastic-wax/52,Agar - gelatin plastic,Fab Lab Santiago,algae,agar agar,glycerin,glycerin,food,gelatin,water,water,heat,bioplastic,soft,bioplastic,translucent bioplastic soft flexible,https://materiom.org/recipe/2453,Agar bioplastic (heated),Alysia Garmulewicz  ,algae,agar agar,glycerin,glycerin,water,water, , ,heat,material,soft,bioplastic,transparent translucent bioplastic flexible ,https://materiom.org/recipe/4154,Gelatin bioplastic,FabTextiles  ,glycerin,glycerin,food,gelatin,water,water, , ,heat,bioplastic,hard,bioplastic,elastic transparent translucent bioplastic ,http://fabtextiles.org/the-secrets-of-bioplastic/55,Gelatin / ochre 'leather',Fab Lab Santiago,glycerin,glycerin,food,gelatin ,water,water,mineral,red ochre,heat,textile,hard,leather,leather bio-based hard flat ,https://materiom.org/recipe/3256,MarinaTex ,Lucy Hughes,seafood,fish skin,vinegar,vinegar , , , , ,heat,material,soft,bioplastic,bioplastic transparent translucent seafood fish food-waste marine,https://www.dezeen.com/2019/11/15/marinatex-lucy-hughes-james-dyson-award-design/57,DIY bioplastics,Lucia Borroni,food,orange peel,starch,starch,chemical,sodium bicarbonate,vinegar,lemon juice,heat,bioplastic,hard,bioplastic,coffee hard homeware rough bowl mug ,https://www.youtube.com/watch?v=PrUjjzznwEE58,DIY bioplastics,Lucia Borroni,food,coffee ground,starch,starch,chemical,sodium bicarbonate,vinegar,vinegar,heat,bioplastic,hard,bioplastic,hard homeware rough bowl ,https://www.youtube.com/watch?v=PrUjjzznwEE59,Bio plastic from watermelon,Ong SK,food,watermelon peel,starch,starch,food,honey,vinegar,lemon juice,heat,bioplastic,soft,bioplastic,flexible soft material,https://www.youtube.com/watch?v=Ql9J84zmMAU60,Banana bioplastic,Mattia Massetti,food,banana peel,glycerin,glycerin,vinegar,vinegar,chemical,baking soda,heat,bioplastic,hard,bioplastic,hard homeware rough ,https://www.youtube.com/watch?v=ielBPntT5W861,DIY bioPlastic,"Scuola di Ateneo Architettura e Design ""E. Vittoria"" Camilla Cardellini Benedetta Celani Michela Falcetelli",food,tea waste,starch,starch,vinegar,vinegar,food,honey,heat,bioplastic,hard,bioplastic,hard homeware rough flat,https://www.youtube.com/watch?v=Z1gLJ5jdGOM62,BIOPLASTIC GRAPES,Sperim Design,food,grapes peel,starch,starch,vinegar,lemon juice,food,honey,heat,bioplastic,hard,bioplastic,hard bowl mug houseware food rough,https://www.youtube.com/watch?v=Gmj2vNiWxjs63,Bioplastic Coffee,UNICAM - Course of experimentation of innovative materials ,food,coffee ground,starch,starch,vinegar,vinegar,glycerin,glycerin,heat,bioplastic,hard,bioplastic,coffee hard board game mould food rough,https://www.youtube.com/watch?v=Zwu0H5KTys064,Bioplastic BIO CC,Fabbiana Cimini,food,nut shell,food,coffee ground,algae,agar,glycerin,glycerin,heat,bioplastic,hard,bioplastic,cork hard flat board rough coffee game mould food rough,https://www.youtube.com/watch?v=8aCOXp9eNME65,Make Bioplastic,Science Luxembourg,starch,starch,glycerin,glycerin,vinegar,vinegar, , ,heat,bioplastic,flexible,bioplastic,elastic translucent bioplastic ,https://www.youtube.com/watch?v=Cqg-QpaF1lk66,Home Bioplastic,,starch,starch,food,oil,water,water, , ,heat,bioplastic,soft,bioplastic,elastic bioplastic ,https://www.youtube.com/watch?v=OcqNG-OmiiM67,Eco-friendly Bioplastics,,starch,starch,vinegar,vinegar,glycerin,glycerin,algae,agar,heat,bioplastic,hard,bioplastic,bioplastic biodegarable transparent translucent food wrap,https://www.youtube.com/watch?v=o89wbDhhvto68,bioplastic soles,Aurora Pelaggi Christian Simone,starch,starch,chemical,coal,vinegar,vinegar,glycerin,glycerin,heat,bioplastic,hard,bioplastic,shoe fashion hard rubber sole,https://www.youtube.com/watch?v=mj9MxES_Yuw69,Fish Glue,,seafood,fish, , , , , , ,heat,glue,soft,bioresin,tool glue bio-resin plant seafood collagen marine,https://www.youtube.com/watch?v=IsmE735g3qI70,Pine Pitch Glue,,plant,pine pitch, , , , , , ,heat,glue,soft,bioresin,tool glue bio-resin plant,https://www.youtube.com/watch?v=Vr1tQuq1rIs71,Bioplastic Jewelry,Lili Design Ltd,starch,starch,glycerin,glycerin,vinegar,vinegar,water,water,heat,bioplastic,soft,bioplastic,jewelry transparent mould,https://www.youtube.com/watch?v=-7KCzldr75o72, Recycle HDPE Plastic,Atomic Shrimp,plastic,plastic, , , , , , ,heat,composite,hard,material,plastic heatpress hdpe recycle flat tile,https://www.youtube.com/watch?v=W_XUJwINdLw73,Grape pomace / agar,LABVA,food,grape,glycerin,glycerin,algae,agar agar, , ,heat,bioplastic,hard,bioplastic,dry hard translucent material,https://materiom.org/recipe/3674,Walnut shell | mycelium WS01,Laboratorio de Biofabricación FADEU   Sebastian Rodriguez  ,food,nut shell,fungi,mycelium,chemical,flour, , ,heat,composite,hard,material,composite mug bowl rough solid,https://materiom.org/recipe/3375,Aqua Shelltic,Kit Sam Lam Bing Yim Secondary School,algae,seaweed,food,egg shell,vinegar,vinegar,,,heat,bioplastic,flexible,bioplastic,food wrap transparent translucent stretch flexible calcium lactate,http://startupbeat.hkej.com/?p=7361276,Ari Jónsson,Ari Jónsson,algae ,red algae powder,water,water,,,,,heat,bioplastic,hard,bioplastic,red algae powder bottle mug bioplastic biodegradable translucent,https://www.dezeen.com/2016/03/20/ari-jonsson-algae-biodegradable-water-bottles-iceland/77,From Peel to Peel ,Emma Sicher,food,fruit peel,cellulose,cellulose,,,,,mix,bioplastic,hard,bioplastic,fermented microbial cellulose grow bioplastic translucent food package,https://www.dezeen.com/2018/11/13/sustainable-food-packaging-emma-sicher-peel/?li_source=LI&li_medium=bottom_block_178,Bio Iridescent Sequin,Elissa Brunato,Cellulose,Cellulose,,,,,,,grow,textile,hard,material,grow cellulose shining fashion textile,https://www.dezeen.com/2019/08/02/bio-iridescent-sequin-elissa-brunato-sustainable-fashion/?li_source=LI&li_medium=rhs_block_279,,,algae,red algae, , , , , , ,heat,bioplastic,soft,bioplastic,algae transparent translucent bioplastic ,80,,,animal,animal bone, , , , , , ,heat,glue,soft,bioresin,bone glus natural resin bio-resin,81,,,starch,starch,glycerin,glycerin,vinegar,vinegar,water,water,heat,bioplastic,flexible,bioplastic,translucent,82,,,starch,starch,glycerin,glycerin,vinegar,vinegar,oil,oil,heat,bioplastic,flexible,bioplastic,translucent,83,,,food,banana peel ,vinegar,vinegar,food,honey, , ,heat,bioplastic,soft,bioplastic,composite soft ,